    275 0.000262       134.108.8.37          134.108.8.36          TCP      2962   9001 → 48072 [PSH, ACK] Seq=8689 Ack=60001 Win=2896 Len=2896 TSval=6553094 TSecr=8187173
    276 0.000027       134.108.8.36          134.108.8.37          TCP      66     48072 → 9001 [ACK] Seq=60001 Ack=11585 Win=2920 Len=0 TSval=8187173 TSecr=6553094
    277 0.000180       134.108.8.37          134.108.8.36          TCP      2482   9001 → 48072 [PSH, ACK] Seq=11585 Ack=60001 Win=2896 Len=2416 TSval=6553094 TSecr=8187173
    278 0.000026       134.108.8.36          134.108.8.37          TCP      66     48072 → 9001 [ACK] Seq=60001 Ack=14001 Win=2920 Len=0 TSval=8187174 TSecr=6553094
    279 0.000022       134.108.8.36          134.108.8.37          TCP      69     48072 → 9001 [PSH, ACK] Seq=60001 Ack=14001 Win=2920 Len=3 TSval=8187174 TSecr=6553094
    280 0.000017       134.108.8.36          134.108.8.37          TCP      66     48072 → 9001 [FIN, ACK] Seq=60004 Ack=14001 Win=2920 Len=0 TSval=8187174 TSecr=6553094
    281 0.000146       134.108.8.37          134.108.8.36          TCP      66     9001 → 48072 [ACK] Seq=14001 Ack=60004 Win=2896 Len=0 TSval=6553094 TSecr=8187174
    282 0.039033       134.108.8.37          134.108.8.36          TCP      66     9001 → 48072 [ACK] Seq=14001 Ack=60005 Win=2896 Len=0 TSval=6553134 TSecr=8187174
    287 0.961062       134.108.8.37          134.108.8.36          TCP      66     9001 → 48072 [FIN, ACK] Seq=14001 Ack=60005 Win=2896 Len=0 TSval=6554095 TSecr=8187174
    288 0.000038       134.108.8.36          134.108.8.37          TCP      66     48072 → 9001 [ACK] Seq=60005 Ack=14002 Win=2920 Len=0 TSval=8188174 TSecr=6554095
