    316 0.000215       134.108.8.37          134.108.8.36          TCP      2962   9001 → 48074 [PSH, ACK] Seq=8689 Ack=60001 Win=2896 Len=2896 TSval=6560566 TSecr=8194645
    317 0.000063       134.108.8.36          134.108.8.37          TCP      66     48074 → 9001 [ACK] Seq=60001 Ack=11585 Win=2920 Len=0 TSval=8194645 TSecr=6560566
    318 0.000218       134.108.8.37          134.108.8.36          TCP      2482   9001 → 48074 [PSH, ACK] Seq=11585 Ack=60001 Win=2896 Len=2416 TSval=6560566 TSecr=8194645
    319 0.000028       134.108.8.36          134.108.8.37          TCP      66     48074 → 9001 [ACK] Seq=60001 Ack=14001 Win=2920 Len=0 TSval=8194645 TSecr=6560566
    320 0.000029       134.108.8.36          134.108.8.37          TCP      69     48074 → 9001 [PSH, ACK] Seq=60001 Ack=14001 Win=2920 Len=3 TSval=8194645 TSecr=6560566
    321 0.000013       134.108.8.36          134.108.8.37          TCP      66     48074 → 9001 [FIN, ACK] Seq=60004 Ack=14001 Win=2920 Len=0 TSval=8194645 TSecr=6560566
    322 0.000141       134.108.8.37          134.108.8.36          TCP      66     9001 → 48074 [ACK] Seq=14001 Ack=60004 Win=2896 Len=0 TSval=6560566 TSecr=8194645
    323 0.039375       134.108.8.37          134.108.8.36          TCP      66     9001 → 48074 [ACK] Seq=14001 Ack=60005 Win=2896 Len=0 TSval=6560606 TSecr=8194645
    330 0.960711       134.108.8.37          134.108.8.36          TCP      66     9001 → 48074 [FIN, ACK] Seq=14001 Ack=60005 Win=2896 Len=0 TSval=6561566 TSecr=8194645
    331 0.000037       134.108.8.36          134.108.8.37          TCP      66     48074 → 9001 [ACK] Seq=60005 Ack=14002 Win=2920 Len=0 TSval=8195645 TSecr=6561566
