     43 0.000023       134.108.8.36          134.108.8.37          TCP      66     48072 → 9001 [ACK] Seq=1 Ack=1 Win=2920 Len=0 TSval=8168450 TSecr=6534371
     76 4.598437       134.108.8.36          134.108.8.37          TCP      1514   48072 → 9001 [ACK] Seq=1 Ack=1 Win=2920 Len=1448 TSval=8173049 TSecr=6534371
     77 0.000019       134.108.8.36          134.108.8.37          TCP      1514   [TCP Window Full] 48072 → 9001 [PSH, ACK] Seq=1449 Ack=1 Win=2920 Len=1448 TSval=8173049 TSecr=6534371
     78 0.000201       134.108.8.37          134.108.8.36          TCP      66     9001 → 48072 [ACK] Seq=1 Ack=2897 Win=2896 Len=0 TSval=6538970 TSecr=8173049
     79 0.000033       134.108.8.36          134.108.8.37          TCP      1514   48072 → 9001 [ACK] Seq=2897 Ack=1 Win=2920 Len=1448 TSval=8173049 TSecr=6538970
     80 0.000010       134.108.8.36          134.108.8.37          TCP      1514   [TCP Window Full] 48072 → 9001 [PSH, ACK] Seq=4345 Ack=1 Win=2920 Len=1448 TSval=8173049 TSecr=6538970
     81 0.000188       134.108.8.37          134.108.8.36          TCP      66     9001 → 48072 [ACK] Seq=1 Ack=5793 Win=2896 Len=0 TSval=6538970 TSecr=8173049
     82 0.000028       134.108.8.36          134.108.8.37          TCP      1514   48072 → 9001 [ACK] Seq=5793 Ack=1 Win=2920 Len=1448 TSval=8173049 TSecr=6538970
     83 0.000010       134.108.8.36          134.108.8.37          TCP      1514   [TCP Window Full] 48072 → 9001 [PSH, ACK] Seq=7241 Ack=1 Win=2920 Len=1448 TSval=8173049 TSecr=6538970
     84 0.000220       134.108.8.37          134.108.8.36          TCP      66     9001 → 48072 [ACK] Seq=1 Ack=8689 Win=2896 Len=0 TSval=6538970 TSecr=8173049
     85 0.000028       134.108.8.36          134.108.8.37          TCP      1514   48072 → 9001 [ACK] Seq=8689 Ack=1 Win=2920 Len=1448 TSval=8173049 TSecr=6538970
     86 0.000010       134.108.8.36          134.108.8.37          TCP      1514   [TCP Window Full] 48072 → 9001 [PSH, ACK] Seq=10137 Ack=1 Win=2920 Len=1448 TSval=8173049 TSecr=6538970
     87 0.000227       134.108.8.37          134.108.8.36          TCP      66     9001 → 48072 [ACK] Seq=1 Ack=11585 Win=2896 Len=0 TSval=6538971 TSecr=8173049
     88 0.000027       134.108.8.36          134.108.8.37          TCP      1514   48072 → 9001 [ACK] Seq=11585 Ack=1 Win=2920 Len=1448 TSval=8173050 TSecr=6538971
     89 0.000009       134.108.8.36          134.108.8.37          TCP      1514   [TCP Window Full] 48072 → 9001 [PSH, ACK] Seq=13033 Ack=1 Win=2920 Len=1448 TSval=8173050 TSecr=6538971
     90 0.000171       134.108.8.37          134.108.8.36          TCP      66     9001 → 48072 [ACK] Seq=1 Ack=14481 Win=2896 Len=0 TSval=6538971 TSecr=8173050
     91 0.000028       134.108.8.36          134.108.8.37          TCP      1514   48072 → 9001 [ACK] Seq=14481 Ack=1 Win=2920 Len=1448 TSval=8173050 TSecr=6538971
     92 0.000009       134.108.8.36          134.108.8.37          TCP      1514   [TCP Window Full] 48072 → 9001 [PSH, ACK] Seq=15929 Ack=1 Win=2920 Len=1448 TSval=8173050 TSecr=6538971
