    156 0.000017       134.108.8.36          134.108.8.37          TCP      1514   [TCP Window Full] 48074 → 9001 [PSH, ACK] Seq=1449 Ack=1 Win=2920 Len=1448 TSval=8177457 TSecr=6542740
    157 0.000187       134.108.8.37          134.108.8.36          TCP      66     9001 → 48074 [ACK] Seq=1 Ack=2897 Win=2896 Len=0 TSval=6543378 TSecr=8177457
    158 0.000033       134.108.8.36          134.108.8.37          TCP      1514   48074 → 9001 [ACK] Seq=2897 Ack=1 Win=2920 Len=1448 TSval=8177457 TSecr=6543378
    159 0.000009       134.108.8.36          134.108.8.37          TCP      1514   [TCP Window Full] 48074 → 9001 [PSH, ACK] Seq=4345 Ack=1 Win=2920 Len=1448 TSval=8177457 TSecr=6543378
    160 0.000224       134.108.8.37          134.108.8.36          TCP      66     9001 → 48074 [ACK] Seq=1 Ack=5793 Win=2896 Len=0 TSval=6543378 TSecr=8177457
    161 0.000028       134.108.8.36          134.108.8.37          TCP      1514   48074 → 9001 [ACK] Seq=5793 Ack=1 Win=2920 Len=1448 TSval=8177457 TSecr=6543378
    162 0.000010       134.108.8.36          134.108.8.37          TCP      1514   [TCP Window Full] 48074 → 9001 [PSH, ACK] Seq=7241 Ack=1 Win=2920 Len=1448 TSval=8177457 TSecr=6543378
    163 0.000190       134.108.8.37          134.108.8.36          TCP      66     9001 → 48074 [ACK] Seq=1 Ack=8689 Win=2896 Len=0 TSval=6543378 TSecr=8177457
    164 0.000028       134.108.8.36          134.108.8.37          TCP      1514   48074 → 9001 [ACK] Seq=8689 Ack=1 Win=2920 Len=1448 TSval=8177457 TSecr=6543378
    165 0.000009       134.108.8.36          134.108.8.37          TCP      1514   [TCP Window Full] 48074 → 9001 [PSH, ACK] Seq=10137 Ack=1 Win=2920 Len=1448 TSval=8177457 TSecr=6543378
    166 0.000197       134.108.8.37          134.108.8.36          TCP      66     9001 → 48074 [ACK] Seq=1 Ack=11585 Win=2896 Len=0 TSval=6543378 TSecr=8177457
    167 0.000026       134.108.8.36          134.108.8.37          TCP      1514   48074 → 9001 [ACK] Seq=11585 Ack=1 Win=2920 Len=1448 TSval=8177458 TSecr=6543378
