    929 0.000000       134.108.8.37          134.108.8.36          TCP      74     9002 → 9001 [SYN] Seq=0 Win=2920 Len=0 MSS=1460 SACK_PERM=1 TSval=11646580 TSecr=0 WS=1
    930 0.000054       134.108.8.36          134.108.8.37          TCP      74     9001 → 9002 [SYN, ACK] Seq=0 Ack=1 Win=2896 Len=0 MSS=1460 SACK_PERM=1 TSval=13280659 TSecr=11646580 WS=1
    931 0.000204       134.108.8.37          134.108.8.36          TCP      66     9002 → 9001 [ACK] Seq=1 Ack=1 Win=2920 Len=0 TSval=11646581 TSecr=13280659
   1186 38.375580      134.108.8.37          134.108.8.36          TCP      74     55008 → 9001 [SYN] Seq=0 Win=2920 Len=0 MSS=1460 SACK_PERM=1 TSval=11684956 TSecr=0 WS=1
   1187 0.000047       134.108.8.36          134.108.8.37          TCP      74     9001 → 55008 [SYN, ACK] Seq=0 Ack=1 Win=2896 Len=0 MSS=1460 SACK_PERM=1 TSval=13319035 TSecr=11684956 WS=1
   1188 0.000190       134.108.8.37          134.108.8.36          TCP      66     55008 → 9001 [ACK] Seq=1 Ack=1 Win=2920 Len=0 TSval=11684956 TSecr=13319035
   1440 23.796940      134.108.8.37          134.108.8.36          TCP      69     9002 → 9001 [PSH, ACK] Seq=1 Ack=1 Win=2920 Len=3 TSval=11708754 TSecr=13280659
   1441 0.000034       134.108.8.36          134.108.8.37          TCP      66     9001 → 9002 [ACK] Seq=1 Ack=4 Win=2896 Len=0 TSval=13342832 TSecr=11708754
   1442 0.000009       134.108.8.37          134.108.8.36          TCP      66     9002 → 9001 [FIN, ACK] Seq=4 Ack=1 Win=2920 Len=0 TSval=11708754 TSecr=13280659
   1444 0.039504       134.108.8.36          134.108.8.37          TCP      66     9001 → 9002 [ACK] Seq=1 Ack=5 Win=2896 Len=0 TSval=13342872 TSecr=11708754
   1518 7.840354       134.108.8.37          134.108.8.36          TCP      69     55008 → 9001 [PSH, ACK] Seq=1 Ack=1 Win=2920 Len=3 TSval=11716634 TSecr=13319035
   1519 0.000035       134.108.8.36          134.108.8.37          TCP      66     9001 → 55008 [ACK] Seq=1 Ack=4 Win=2896 Len=0 TSval=13350712 TSecr=11716634
   1520 0.000009       134.108.8.37          134.108.8.36          TCP      66     55008 → 9001 [FIN, ACK] Seq=4 Ack=1 Win=2920 Len=0 TSval=11716634 TSecr=13319035
   1521 0.039615       134.108.8.36          134.108.8.37          TCP      66     9001 → 55008 [ACK] Seq=1 Ack=5 Win=2896 Len=0 TSval=13350752 TSecr=11716634
   1775 23.666174      134.108.8.36          134.108.8.37          TCP      66     9001 → 9002 [FIN, ACK] Seq=1 Ack=5 Win=2896 Len=0 TSval=13374418 TSecr=11708754
   1776 0.000196       134.108.8.37          134.108.8.36          TCP      66     9002 → 9001 [ACK] Seq=5 Ack=2 Win=2920 Len=0 TSval=11740340 TSecr=13374418
   1865 8.703774       134.108.8.36          134.108.8.37          TCP      66     9001 → 55008 [FIN, ACK] Seq=1 Ack=5 Win=2896 Len=0 TSval=13383122 TSecr=11716634
   1866 0.000242       134.108.8.37          134.108.8.36          TCP      66     55008 → 9001 [ACK] Seq=5 Ack=2 Win=2920 Len=0 TSval=11749044 TSecr=13383122
