   2244 0.000000       134.108.8.36          134.108.8.37          TCP      74     48376 → 9001 [SYN] Seq=0 Win=14600 Len=0 MSS=1460 SACK_PERM=1 TSval=14868831 TSecr=0 WS=128
   2245 0.000199       134.108.8.37          134.108.8.36          TCP      74     9001 → 48376 [SYN, ACK] Seq=0 Ack=1 Win=14480 Len=0 MSS=1460 SACK_PERM=1 TSval=13234754 TSecr=14868831 WS=128
   2246 0.000043       134.108.8.36          134.108.8.37          TCP      66     48376 → 9001 [ACK] Seq=1 Ack=1 Win=14720 Len=0 TSval=14868832 TSecr=13234754
   2287 5.998053       134.108.8.36          134.108.8.37          TCP      74     48378 → 9001 [SYN] Seq=0 Win=14600 Len=0 MSS=1460 SACK_PERM=1 TSval=14874830 TSecr=0 WS=128
   2288 0.000221       134.108.8.37          134.108.8.36          TCP      74     9001 → 48378 [SYN, ACK] Seq=0 Ack=1 Win=14480 Len=0 MSS=1460 SACK_PERM=1 TSval=13240752 TSecr=14874830 WS=128
   2289 0.000032       134.108.8.36          134.108.8.37          TCP      66     48378 → 9001 [ACK] Seq=1 Ack=1 Win=14720 Len=0 TSval=14874830 TSecr=13240752
   2526 25.934500      134.108.8.36          134.108.8.37          TCP      2962   48378 → 9001 [ACK] Seq=1 Ack=1 Win=14720 Len=2896 TSval=14900765 TSecr=13240752
   2527 0.000019       134.108.8.36          134.108.8.37          TCP      170    48378 → 9001 [PSH, ACK] Seq=2897 Ack=1 Win=14720 Len=104 TSval=14900765 TSecr=13240752
   2528 0.000245       134.108.8.37          134.108.8.36          TCP      66     9001 → 48378 [ACK] Seq=1 Ack=3001 Win=17408 Len=0 TSval=13266687 TSecr=14900765
   2529 0.000213       134.108.8.37          134.108.8.36          TCP      2066   9001 → 48378 [PSH, ACK] Seq=1 Ack=3001 Win=17408 Len=2000 TSval=13266687 TSecr=14900765
   2530 0.000045       134.108.8.36          134.108.8.37          TCP      66     48378 → 9001 [ACK] Seq=3001 Ack=2001 Win=17536 Len=0 TSval=14900765 TSecr=13266687
   2592 10.327453      134.108.8.36          134.108.8.37          TCP      2962   48376 → 9001 [ACK] Seq=1 Ack=1 Win=14720 Len=2896 TSval=14911093 TSecr=13234754
   2593 0.000015       134.108.8.36          134.108.8.37          TCP      170    48376 → 9001 [PSH, ACK] Seq=2897 Ack=1 Win=14720 Len=104 TSval=14911093 TSecr=13234754
   2594 0.000252       134.108.8.37          134.108.8.36          TCP      66     9001 → 48376 [ACK] Seq=1 Ack=3001 Win=17408 Len=0 TSval=13277015 TSecr=14911093
   2595 0.000236       134.108.8.37          134.108.8.36          TCP      2066   9001 → 48376 [PSH, ACK] Seq=1 Ack=3001 Win=17408 Len=2000 TSval=13277015 TSecr=14911093
   2596 0.000062       134.108.8.36          134.108.8.37          TCP      66     48376 → 9001 [ACK] Seq=3001 Ack=2001 Win=17536 Len=0 TSval=14911093 TSecr=13277015
   2717 12.231667      134.108.8.36          134.108.8.37          TCP      2962   48376 → 9001 [ACK] Seq=3001 Ack=2001 Win=17536 Len=2896 TSval=14923325 TSecr=13277015
   2718 0.000016       134.108.8.36          134.108.8.37          TCP      170    48376 → 9001 [PSH, ACK] Seq=5897 Ack=2001 Win=17536 Len=104 TSval=14923325 TSecr=13277015
   2719 0.000315       134.108.8.37          134.108.8.36          TCP      66     9001 → 48376 [ACK] Seq=2001 Ack=6001 Win=20352 Len=0 TSval=13289247 TSecr=14923325
   2720 0.000112       134.108.8.37          134.108.8.36          TCP      2066   9001 → 48376 [PSH, ACK] Seq=2001 Ack=6001 Win=20352 Len=2000 TSval=13289247 TSecr=14923325
   2721 0.000064       134.108.8.36          134.108.8.37          TCP      66     48376 → 9001 [ACK] Seq=6001 Ack=4001 Win=20480 Len=0 TSval=14923325 TSecr=13289247
   2722 0.000040       134.108.8.36          134.108.8.37          TCP      69     48376 → 9001 [PSH, ACK] Seq=6001 Ack=4001 Win=20480 Len=3 TSval=14923325 TSecr=13289247
   2723 0.000022       134.108.8.36          134.108.8.37          TCP      66     48376 → 9001 [FIN, ACK] Seq=6004 Ack=4001 Win=20480 Len=0 TSval=14923325 TSecr=13289247
   2724 0.038853       134.108.8.37          134.108.8.36          TCP      66     9001 → 48376 [ACK] Seq=4001 Ack=6005 Win=20352 Len=0 TSval=13289287 TSecr=14923325
   2734 0.961439       134.108.8.37          134.108.8.36          TCP      66     9001 → 48376 [FIN, ACK] Seq=4001 Ack=6005 Win=20352 Len=0 TSval=13290248 TSecr=14923325
   2735 0.000036       134.108.8.36          134.108.8.37          TCP      66     48376 → 9001 [ACK] Seq=6005 Ack=4002 Win=20480 Len=0 TSval=14924326 TSecr=13290248
   2756 1.887127       134.108.8.36          134.108.8.37          TCP      2962   48378 → 9001 [ACK] Seq=3001 Ack=2001 Win=17536 Len=2896 TSval=14926213 TSecr=13266687
   2757 0.000021       134.108.8.36          134.108.8.37          TCP      170    48378 → 9001 [PSH, ACK] Seq=5897 Ack=2001 Win=17536 Len=104 TSval=14926213 TSecr=13266687
   2758 0.000223       134.108.8.37          134.108.8.36          TCP      66     9001 → 48378 [ACK] Seq=2001 Ack=6001 Win=20352 Len=0 TSval=13292135 TSecr=14926213
   2759 0.000168       134.108.8.37          134.108.8.36          TCP      2066   9001 → 48378 [PSH, ACK] Seq=2001 Ack=6001 Win=20352 Len=2000 TSval=13292135 TSecr=14926213
   2760 0.000046       134.108.8.36          134.108.8.37          TCP      66     48378 → 9001 [ACK] Seq=6001 Ack=4001 Win=20480 Len=0 TSval=14926213 TSecr=13292135
   2761 0.000038       134.108.8.36          134.108.8.37          TCP      69     48378 → 9001 [PSH, ACK] Seq=6001 Ack=4001 Win=20480 Len=3 TSval=14926213 TSecr=13292135
   2762 0.000016       134.108.8.36          134.108.8.37          TCP      66     48378 → 9001 [FIN, ACK] Seq=6004 Ack=4001 Win=20480 Len=0 TSval=14926213 TSecr=13292135
   2763 0.038880       134.108.8.37          134.108.8.36          TCP      66     9001 → 48378 [ACK] Seq=4001 Ack=6005 Win=20352 Len=0 TSval=13292175 TSecr=14926213
   2774 0.961381       134.108.8.37          134.108.8.36          TCP      66     9001 → 48378 [FIN, ACK] Seq=4001 Ack=6005 Win=20352 Len=0 TSval=13293136 TSecr=14926213
   2775 0.000035       134.108.8.36          134.108.8.37          TCP      66     48378 → 9001 [ACK] Seq=6005 Ack=4002 Win=20480 Len=0 TSval=14927214 TSecr=13293136
